<?xml version="1.0" encoding="UTF-8"?>
<!ELEMENT chapter (title, summary, body)>
<!ELEMENT title (#PCDATA)>
<!ELEMENT summary (para+)>
<!ELEMENT para (#PCDATA)>
<!ELEMENT body (para+)>

